name,inventory,price,description,img_url,active,id,merchant_id
Citronella Mint-Infused Gauze,225,8.50,"Bug-repellent, cooling gauze for all wounds ranging from blisters to radioactive sores. Dr. Anthony Fauci's gauze of choice.  ",https://lh3.googleusercontent.com/pw/ACtC-3duqMapWWiF91QJXoWm6mkNH0tS21dxIlwyg-1htWkQSgNE4n_A8oOVJUqIIXxU4ABURgyCqiMVXgWftgDSKFV4pWrygUGamHYgWjV2hJm7H8geeTKEabfJAM1mAfaBB0_gqn_HTjfOqXDxgHqlCOSt=w1792-h1194-no?authuser=0,TRUE,1,3
"""The Next End of the World""",10,25.00,"Predictions by Emmett Clarke on the end of the world, when it hits again. How to prepare yourself and your family for ""the big one.""",https://lh3.googleusercontent.com/pw/ACtC-3eMhEM2kaTc-RlRyVudYKP08KOdRO6QbvXTc_PkmzKzXTIkCqRDIa06GMT1FaJr-lDgIcjmnR5hEEFOCYf4YUDKfozbnOhaOw02IpXMOTr2LW4L2S2PXJfedaWYHq6uTewLUuufgMD0VBs_xdtE7FUy=w1350-h900-no?authuser=0,TRUE,2,1
Phosphorous Tubes,50,15.00,Phosphorous-safe tubes for your all your nightlight needs.,https://lh3.googleusercontent.com/pw/ACtC-3eMhEM2kaTc-RlRyVudYKP08KOdRO6QbvXTc_PkmzKzXTIkCqRDIa06GMT1FaJr-lDgIcjmnR5hEEFOCYf4YUDKfozbnOhaOw02IpXMOTr2LW4L2S2PXJfedaWYHq6uTewLUuufgMD0VBs_xdtE7FUy=w1350-h900-no?authuser=0,TRUE,3,2
"12"" Bowie Knife",30,50.00,"From cutting protein to underbrush, our 12"" bowie knife was finely honed and fired for all your needs.",https://lh3.googleusercontent.com/pw/ACtC-3eMhEM2kaTc-RlRyVudYKP08KOdRO6QbvXTc_PkmzKzXTIkCqRDIa06GMT1FaJr-lDgIcjmnR5hEEFOCYf4YUDKfozbnOhaOw02IpXMOTr2LW4L2S2PXJfedaWYHq6uTewLUuufgMD0VBs_xdtE7FUy=w1350-h900-no?authuser=0,TRUE,4,8
Pair of Pullets,20,85.00,Two well-feathered pullets primed for non-fertile egg production. (Item listing is for two pullets only.),https://lh3.googleusercontent.com/pw/ACtC-3eMhEM2kaTc-RlRyVudYKP08KOdRO6QbvXTc_PkmzKzXTIkCqRDIa06GMT1FaJr-lDgIcjmnR5hEEFOCYf4YUDKfozbnOhaOw02IpXMOTr2LW4L2S2PXJfedaWYHq6uTewLUuufgMD0VBs_xdtE7FUy=w1350-h900-no?authuser=0,TRUE,5,7
"""How to Forgive After Your Loved Ones Left You to Die""",80,17.00,Dr. Joy Guffie on moving on after they moved on. A tough-love approach to carving out a new life after being deemed dispensable. ,https://lh3.googleusercontent.com/pw/ACtC-3eMhEM2kaTc-RlRyVudYKP08KOdRO6QbvXTc_PkmzKzXTIkCqRDIa06GMT1FaJr-lDgIcjmnR5hEEFOCYf4YUDKfozbnOhaOw02IpXMOTr2LW4L2S2PXJfedaWYHq6uTewLUuufgMD0VBs_xdtE7FUy=w1350-h900-no?authuser=0,TRUE,6,10
PP Health and Lifestyle Bundle,100,60.00,A DIY kit for making your own sanitary products and birth control. ,https://lh3.googleusercontent.com/pw/ACtC-3eMhEM2kaTc-RlRyVudYKP08KOdRO6QbvXTc_PkmzKzXTIkCqRDIa06GMT1FaJr-lDgIcjmnR5hEEFOCYf4YUDKfozbnOhaOw02IpXMOTr2LW4L2S2PXJfedaWYHq6uTewLUuufgMD0VBs_xdtE7FUy=w1350-h900-no?authuser=0,TRUE,7,6
Crisp Pickles,40,2.00,One jar of homegrown pickles. ,https://lh3.googleusercontent.com/pw/ACtC-3eMhEM2kaTc-RlRyVudYKP08KOdRO6QbvXTc_PkmzKzXTIkCqRDIa06GMT1FaJr-lDgIcjmnR5hEEFOCYf4YUDKfozbnOhaOw02IpXMOTr2LW4L2S2PXJfedaWYHq6uTewLUuufgMD0VBs_xdtE7FUy=w1350-h900-no?authuser=0,FALSE,8,4
Space Blanket Tent,70,45.00,One temporary shelter made of premium foraged space blankets. Bone poles included.,https://lh3.googleusercontent.com/pw/ACtC-3dOO-ZrPytZ51vLzO1Ov1OKA672xuJldJohekzPXAfNdC5uSVI1fcwRTj5rMOBHsEOxrpkEuYkKocurZlu_hD_HXIOexGE1oFoa80P16-LddIelOzo6isHgeSkiUXxSVBqL74sER8ZWpFepeTySRryOcQ=w1958-h1194-no?authuser=0,TRUE,9,9
Wheelbarrow,25,70.00,One premium steel wheelbarrow with splinter-free grips. Great for carting everything from vegetable starts to compost bodies. ,https://lh3.googleusercontent.com/pw/ACtC-3eMhEM2kaTc-RlRyVudYKP08KOdRO6QbvXTc_PkmzKzXTIkCqRDIa06GMT1FaJr-lDgIcjmnR5hEEFOCYf4YUDKfozbnOhaOw02IpXMOTr2LW4L2S2PXJfedaWYHq6uTewLUuufgMD0VBs_xdtE7FUy=w1350-h900-no?authuser=0,TRUE,10,7
Shovel,50,19.99,"A sturdy shovel with a steel head and wooden handle with an ergonomic D-grip design. Great for farming and landscaping, among other things.",https://lh3.googleusercontent.com/pw/ACtC-3cfR5_kvsJamIibNDOjta_9IAZUaRnVzxiZjCESLlydtmjz8M6D0EmD1JdmT1kUPOcNG4eBGRmwysTvlaJhoN24x09OpewfxAcbHagbVyEIpseZd8bw9eiuqBsVQUTf3uGtjV-Zr8qDBdGDJdWIwanj=w1804-h1194-no?authuser=0,TRUE,11,7
Bar Soap,100,2.50,"A simple, multi-purpose bar of soap for all your cleaning needs. It'll leave your hands sparkling clean, unlike your conscience!",https://lh3.googleusercontent.com/pw/ACtC-3eMhEM2kaTc-RlRyVudYKP08KOdRO6QbvXTc_PkmzKzXTIkCqRDIa06GMT1FaJr-lDgIcjmnR5hEEFOCYf4YUDKfozbnOhaOw02IpXMOTr2LW4L2S2PXJfedaWYHq6uTewLUuufgMD0VBs_xdtE7FUy=w1350-h900-no?authuser=0,TRUE,12,3
Switch Blade,75,24.99,"A sharp, multi-use knife. Perfect for carving, cooking, and close combat on-the-go.",https://lh3.googleusercontent.com/pw/ACtC-3cYCkeiMv5_M7RkIOhWelpPyfSH-ve1_MA2I8waJf56gmV6pW3j7inWcchY4jpfPaa2gChg3AEvzAiqsEVre4Ku2Ip9Rhoots1nkv67AY12UhwzN5PketwgYh5YNMIk1tlAIPpC2gr4qaqWkgSlPIYriw=w1792-h1194-no?authuser=0,TRUE,13,8
Fire Starting Kit,25,11.99,"Starting a fire to cook your food or burn your dead is difficult enough without needing to forage for wood. We made it easier for you to get started by putting together this handy kit! Included is a bag of tinder, a bundle of dry kindling, and a box of kiln-dried firewood to get you fired up!",https://lh3.googleusercontent.com/pw/ACtC-3ddiYAQg8EG-4Adh_LstYdbQvqVPhOlHeWkut8J_g8KS7MF55pKmNl8n-mRQ7CyG95Fz3bawwjh1T_HkOMoWCJdsUaTzp-r5p0SGI5RhUvoA29z0Efvge3YQYQtPLRJx19-ds_7CoS_FMIzERY0LCA2Hg=w796-h1194-no?authuser=0,TRUE,14,9
